{
  "$schema": "https://json-schema.org/draft/2020-12/schema",
  "type": "object",
  "properties": {
    "id": {
      "type": "string"
    },
    "name": {
      "type": "string"
    },
    "entity_type": {
      "type": "string"
    },
    "notes_internal": {
      "type": [
        "string",
        "null"
      ]
    }
  },
  "required": [
    "id",
    "name",
    "entity_type",
    "notes_internal"
  ],
  "additionalProperties": false
}